[
  {
    "id": "primeiro-setup",
    "titulo": "Primeiro setup",
    "descricao": "Conclua a fase Primeiro computador.",
    "condicao": { "tipo": "faseConcluida", "faseId": "fase-01" }
  },
  {
    "id": "no-azul",
    "titulo": "No azul",
    "descricao": "Feche um orçamento com 90 pontos ou mais.",
    "condicao": { "tipo": "notaMinima", "passoTipo": "orcamento", "minimo": 0.9 }
  },
  {
    "id": "faro-fino",
    "titulo": "Faro fino",
    "descricao": "Chegue a 30 de segurança digital.",
    "condicao": { "tipo": "atributoMinimo", "atributo": "seguranca", "valor": 30 }
  },
  {
    "id": "tres-em-linha",
    "titulo": "Três em linha",
    "descricao": "Acerte em cheio três passos seguidos.",
    "condicao": { "tipo": "sequenciaPerfeita", "quantidade": 3 }
  }
]
